{
  "route_plan_version": "v1",
  "route_plan_id": "gaia-route-plan-demo-0001",
  "created_at": "2026-04-26T16:00:00Z",
  "mode": "multimodal",
  "origin": {
    "label": "Demo origin",
    "lat": 40.706,
    "lon": -74.011,
    "h3_cell": "8928308280fffff"
  },
  "destination": {
    "label": "Demo destination station",
    "lat": 40.718,
    "lon": -73.998,
    "h3_cell": "89283082807ffff",
    "station_ref": "station-demo-001"
  },
  "departure_time": "2026-04-26T16:15:00Z",
  "arrival_time": "2026-04-26T16:42:00Z",
  "legs": [
    {
      "leg_id": "leg-001-walk",
      "mode": "pedestrian",
      "from": {
        "label": "Demo origin",
        "lat": 40.706,
        "lon": -74.011,
        "h3_cell": "8928308280fffff"
      },
      "to": {
        "label": "Demo platform access",
        "lat": 40.709,
        "lon": -74.007,
        "asset_ref": "platform-demo-001"
      },
      "geometry_ref": "geometry://demo/routes/leg-001",
      "distance_m": 520,
      "duration_s": 480,
      "asset_refs": ["accessibility-feature-demo-001"],
      "risk_tags": ["accessibility-review-needed"],
      "confidence": 0.72
    },
    {
      "leg_id": "leg-002-rail",
      "mode": "rail",
      "from": {
        "label": "Demo platform access",
        "station_ref": "station-demo-origin"
      },
      "to": {
        "label": "Demo destination station",
        "station_ref": "station-demo-001"
      },
      "geometry_ref": "geometry://demo/routes/leg-002",
      "distance_m": 2100,
      "duration_s": 1140,
      "service_refs": ["gtfs://demo/trip/rail-line-a-1615"],
      "asset_refs": ["rail-segment-demo-a-001", "vegetation-encroachment-demo-001", "clearance-envelope-demo-001"],
      "risk_tags": ["vegetation-encroachment-watch"],
      "confidence": 0.78
    }
  ],
  "constraints": {
    "accessibility_required": true,
    "avoid_closed_assets": true,
    "max_transfer_count": 1,
    "allowed_modes": ["pedestrian", "rail"],
    "disallowed_modes": ["road"]
  },
  "provenance": {
    "source_refs": [
      "osm://demo/extract/2026-04-26",
      "gtfs://demo/agency/feed-2026-04-26",
      "fixture://navigation/rail-corridor-lidar/raw-run-0001"
    ],
    "runtime_refs": ["gaia-navigation-routing-runtime@v0.1.0"],
    "model_refs": ["route-risk-scorer-demo-0.1.0"],
    "evidence_refs": ["gaia-nav-lidar-rail-demo-0001"]
  },
  "policy": {
    "safety_status": "advisory",
    "notes": "Demo fixture is not safety-critical navigation. Vegetation watch signal is included for evidence-aware routing.",
    "handling_tags": ["demo", "navigation", "multimodal", "route-plan"]
  }
}
